[
  {
    "toolName": "VS Code Extension API",
    "toolVendorOrProject": "Microsoft",
    "toolVersion": "1.109 (Stable)",
    "description": "Exposes core editor functionality, filesystem access, and terminal control to extensions and background agents.",
    "labSafetyFitnessRequirements": {
      "minimumCapabilityRung": 4,
      "maxAcceptableImaginaryDistance": 12.5,
      "acceptableDirectionLabels": [
        "Local-Deterministic",
        "Filesystem-Aligned"
      ],
      "requiresSeed42GroundTruthAdherence": true,
      "consequentialOperationsExposed": [
        "fs.writeFile",
        "terminal.sendText",
        "commands.executeCommand"
      ],
      "fundamentalFailuresThatDisqualify": [
        "Arbitrary shell execution without user consent",
        "Silent workspace data corruption",
        "Credential leakage via extension host"
      ]
    },
    "toolExecutionProfile": {
      "isIdempotent": false,
      "supportsDryRunMode": false,
      "stateMutability": "High (Direct local filesystem and process mutation)",
      "blastRadius": "User Workspace / Local Machine"
    },
    "interfaceAndSchema": {
      "primaryInterfaceType": "VS Code Extension API (TS/JS)",
      "schemaStandard": "TypeScript Definition Files (.d.ts)",
      "parameterComplexity": "High (Deeply nested objects and event-driven callbacks)",
      "payloadSizeSensitivity": "Moderate (In-process IPC)"
    },
    "authAndVerification": {
      "authMechanism": "OAuth2 / Extension Identity",
      "requiresIndependentAlarmVerification": true,
      "humanInTheLoopRequiredForConsequentialSteps": true
    },
    "agentIntegrationDetails": {
      "primaryUseCases": [
        "Automated refactoring",
        "Dependency management",
        "Agentic debugging"
      ],
      "commonAgentFailureModes": [
        "Over-correction of linter rules",
        "Incomplete file writes causing build breakage",
        "Infinite loop in file-watcher triggers"
      ],
      "recoveryMechanisms": [
        "Git-based rollback",
        "Extension Host restart",
        "Undo/Redo buffer inspection"
      ]
    },
    "compatibility": {
      "supportsMCP": true,
      "requiresStrictTyping": true,
      "supportedModelFamilies": [
        "Gemini",
        "GPT-4",
        "Claude"
      ]
    },
    "notes": "Version 1.109 introduces advanced background agent hooks and slash command support for autonomous skill invocation."
  },
  {
    "toolName": "GitHub REST/GraphQL API",
    "toolVendorOrProject": "GitHub (Microsoft)",
    "toolVersion": "2026-03-10",
    "description": "Programmatic interface for managing repositories, issues, PRs, and GitHub Actions CI/CD workflows.",
    "labSafetyFitnessRequirements": {
      "minimumCapabilityRung": 4,
      "maxAcceptableImaginaryDistance": 8.0,
      "acceptableDirectionLabels": [
        "Protocol-Compliant",
        "Upstream-Stable"
      ],
      "requiresSeed42GroundTruthAdherence": true,
      "consequentialOperationsExposed": [
        "git push",
        "delete repository",
        "create secret"
      ],
      "fundamentalFailuresThatDisqualify": [
        "Unauthorized force-push to protected branches",
        "Exposure of organization-level secrets",
        "Incorrect merge conflict resolution"
      ]
    },
    "toolExecutionProfile": {
      "isIdempotent": true,
      "supportsDryRunMode": true,
      "stateMutability": "Critical (Remote source of truth mutation)",
      "blastRadius": "Repository / Organization / Infrastructure"
    },
    "interfaceAndSchema": {
      "primaryInterfaceType": "REST / GraphQL",
      "schemaStandard": "OpenAPI 3.0 / GraphQL Schema",
      "parameterComplexity": "Moderate (Stateless HTTP verbs)",
      "payloadSizeSensitivity": "High (Subject to rate limits and pagination)"
    },
    "authAndVerification": {
      "authMechanism": "Personal Access Token (PAT) / GitHub App (JWT)",
      "requiresIndependentAlarmVerification": true,
      "humanInTheLoopRequiredForConsequentialSteps": true
    },
    "agentIntegrationDetails": {
      "primaryUseCases": [
        "Automated code review",
        "CI/CD workflow generation",
        "Issue triage"
      ],
      "commonAgentFailureModes": [
        "Rate limit exhaustion",
        "Schema mismatch on experimental endpoints",
        "Hallucinating PR labels"
      ],
      "recoveryMechanisms": [
        "Webhook retries",
        "PAT revocation",
        "Branch protection overrides"
      ]
    },
    "compatibility": {
      "supportsMCP": true,
      "requiresStrictTyping": true,
      "supportedModelFamilies": [
        "Gemini",
        "GPT-4",
        "Claude"
      ]
    },
    "notes": "Authenticating as a GitHub App installation is the preferred method for agentic integration to minimize credential exposure."
  },
  {
    "toolName": "Jira Cloud REST API",
    "toolVendorOrProject": "Atlassian",
    "toolVersion": "v3",
    "description": "API for interacting with Jira software for project tracking, issue lifecycle management, and workflow automation.",
    "labSafetyFitnessRequirements": {
      "minimumCapabilityRung": 3,
      "maxAcceptableImaginaryDistance": 20.0,
      "acceptableDirectionLabels": [
        "Process-Oriented",
        "Audit-Safe"
      ],
      "requiresSeed42GroundTruthAdherence": false,
      "consequentialOperationsExposed": [
        "transition issue",
        "delete project",
        "bulk update"
      ],
      "fundamentalFailuresThatDisqualify": [
        "Accidental deletion of historic audit logs",
        "Circular workflow transitions",
        "PII leakage in public comments"
      ]
    },
    "toolExecutionProfile": {
      "isIdempotent": true,
      "supportsDryRunMode": false,
      "stateMutability": "Moderate (Project state and metadata mutation)",
      "blastRadius": "Project / Team Workspace"
    },
    "interfaceAndSchema": {
      "primaryInterfaceType": "REST",
      "schemaStandard": "OpenAPI / ADF (Atlassian Document Format)",
      "parameterComplexity": "High (Requires ADF for rich text fields)",
      "payloadSizeSensitivity": "Moderate"
    },
    "authAndVerification": {
      "authMechanism": "OAuth 2.0 (3LO) / Basic Auth (API Token)",
      "requiresIndependentAlarmVerification": false,
      "humanInTheLoopRequiredForConsequentialSteps": false
    },
    "agentIntegrationDetails": {
      "primaryUseCases": [
        "Automated task updates",
        "Sprint report generation",
        "Dependency mapping"
      ],
      "commonAgentFailureModes": [
        "ADF format validation errors",
        "Broken workflow logic",
        "Incorrect permission escalation"
      ],
      "recoveryMechanisms": [
        "History tab audit",
        "Issue restore from backup",
        "API Token rotation"
      ]
    },
    "compatibility": {
      "supportsMCP": true,
      "requiresStrictTyping": true,
      "supportedModelFamilies": [
        "Gemini",
        "GPT-4"
      ]
    },
    "notes": "Version 3 is the current standard for Jira Cloud, specifically supporting the complex Atlassian Document Format (ADF) for content."
  },
  {
    "toolName": "IntelliJ Platform SDK (JetBrains)",
    "toolVendorOrProject": "JetBrains",
    "toolVersion": "2025.3 (LTS)",
    "description": "Open source platform for building IDEs, providing Program Structure Interface (PSI) for deep code analysis and manipulation.",
    "labSafetyFitnessRequirements": {
      "minimumCapabilityRung": 4,
      "maxAcceptableImaginaryDistance": 10.0,
      "acceptableDirectionLabels": [
        "Semantic-Aligned",
        "Strict-Type-Safe"
      ],
      "requiresSeed42GroundTruthAdherence": true,
      "consequentialOperationsExposed": [
        "RefactoringManager",
        "VFS (Virtual File System) writes",
        "ProjectComponent persistence"
      ],
      "fundamentalFailuresThatDisqualify": [
        "Invalid PSI tree mutations leading to IDE crashes",
        "Non-thread-safe write actions",
        "Memory leaks in long-running services"
      ]
    },
    "toolExecutionProfile": {
      "isIdempotent": false,
      "supportsDryRunMode": true,
      "stateMutability": "High (Deep semantic model mutation)",
      "blastRadius": "Project PSI / Local IDE State"
    },
    "interfaceAndSchema": {
      "primaryInterfaceType": "Java/Kotlin API",
      "schemaStandard": "Plugin XML / Extension Points",
      "parameterComplexity": "Extreme (Abstract Syntax Trees and multi-threaded threading models)",
      "payloadSizeSensitivity": "Low (In-memory access)"
    },
    "authAndVerification": {
      "authMechanism": "JetBrains Account / Hub",
      "requiresIndependentAlarmVerification": true,
      "humanInTheLoopRequiredForConsequentialSteps": true
    },
    "agentIntegrationDetails": {
      "primaryUseCases": [
        "Deep semantic refactoring",
        "Static analysis custom rules",
        "Plugin development assistance"
      ],
      "commonAgentFailureModes": [
        "Read-access-from-write-thread exceptions",
        "Broken indices during large-scale changes",
        "Plugin descriptor conflicts"
      ],
      "recoveryMechanisms": [
        "Local History (VCS-independent)",
        "Invalidate Caches / Restart",
        "Thread dump analysis"
      ]
    },
    "compatibility": {
      "supportsMCP": false,
      "requiresStrictTyping": true,
      "supportedModelFamilies": [
        "Claude 3.5 Sonnet",
        "GPT-4o"
      ]
    },
    "notes": "Utilizes the PersistentStateComponent interface to manage state between IDE restarts, ensuring agent state durability."
  },
  {
    "toolName": "Apollo GraphQL (via Apollo MCP Server)",
    "toolVendorOrProject": "Apollo GraphQL",
    "toolVersion": "2026-03 (Agent-Ready)",
    "description": "Bridges AI agents to GraphQL schemas using Model Context Protocol (MCP), providing type-safe introspection and operation execution.",
    "labSafetyFitnessRequirements": {